{
  "$schema": "./signer.policy.schema.json",
  "version": 1,
  "chainId": 1,
  "description": "Broadcast allow-list for the bot's session signer. Enforced in apps/bot/src/core/signerPolicy.ts (mode: SIGNER_POLICY_MODE). Generated from the exact SDK-emitted execution targets in packages/shared/src/addresses.ts; registry membership alone never grants signing authority — do not edit by hand; run `node scripts/gen-signer-policy.mjs`.",
  "rules": {
    "allowedTargetsOnly": true,
    "exactSelectorsOnly": true,
    "exactActionArguments": [
      "market pool and side",
      "input/output token",
      "authenticated receiver/owner",
      "action amount and minimum output",
      "native transaction value"
    ],
    "arbitraryPayableValue": false,
    "approvals": {
      "approve": "0x095ea7b3",
      "exactRouteAmount": true,
      "correlatedToLaterAction": true,
      "unlimited": false,
      "blanketPositionApproval": false
    },
    "embeddedConversion": {
      "target": "0x12af4529129303d7fbd2563e242c4a2890525912",
      "selector": "convert(address,uint256,uint256,uint256[])",
      "exactTokenAndAmount": true,
      "externalSignaturePayloads": false,
      "permittedSdkRoutes": [
        "FxRoute",
        "FxRoute 2"
      ],
      "remoteAggregators": false
    },
    "cancellationSelfSend": "authenticated persisted replacement only"
  },
  "allowedTargets": [
    {
      "label": "FX_MINT_ROUTER",
      "address": "0xb753366082466c4b5984312f0c4bb97554be067e"
    },
    {
      "label": "FXSAVE",
      "address": "0x7743e50f534a7f9f1791dde7dcd89f7783eefc39"
    },
    {
      "label": "FXSAVE_OFT_ADAPTER",
      "address": "0xcad2b9c980322f460db51cc8e45539f677c73f86"
    },
    {
      "label": "FXUSD",
      "address": "0x085780639cc2cacd35e474e71f4d000e2405d8f6"
    },
    {
      "label": "FXUSD_BASE_POOL",
      "address": "0x65c9a641afceb9c0e6034e558a319488fa0fa3be"
    },
    {
      "label": "FXUSD_OFT_ADAPTER",
      "address": "0xa07d8cc424421cc2bce0544a65481376f010a438"
    },
    {
      "label": "ROUTER",
      "address": "0x33636d49fbefbe798e15e7f356e8dbef543cc708"
    },
    {
      "label": "STETH",
      "address": "0xae7ab96520de3a18e5e111b5eaab095312d7fe84"
    },
    {
      "label": "USDC",
      "address": "0xa0b86991c6218b36c1d19d4a2e9eb0ce3606eb48"
    },
    {
      "label": "USDT",
      "address": "0xdac17f958d2ee523a2206206994597c13d831ec7"
    },
    {
      "label": "WBTC",
      "address": "0x2260fac5e5542a773aa44fbcfedf7c193bc2c599"
    },
    {
      "label": "WBTC_LONG_POOL",
      "address": "0xab709e26fa6b0a30c119d8c55b887ded24952473"
    },
    {
      "label": "WBTC_SHORT_POOL",
      "address": "0xa0cc8162c523998856d59065faa254f87d20a5b0"
    },
    {
      "label": "WETH",
      "address": "0xc02aaa39b223fe8d0a0e5c4f27ead9083c756cc2"
    },
    {
      "label": "WSTETH",
      "address": "0x7f39c581f595b53c5cb19bd0b3f8da6c935e2ca0"
    },
    {
      "label": "WSTETH_LONG_POOL",
      "address": "0x6ecfa38fee8a5277b91efda204c235814f0122e8"
    },
    {
      "label": "WSTETH_SHORT_POOL",
      "address": "0x25707b9e6690b52c60ae6744d711cf9c1dfc1876"
    }
  ]
}
